{
  "id": "kalaignar-song-en-007",
  "song_id": "kalaignar-song-007",
  "anthology_song_number": 7,
  "target_language": "en",
  "status": "verified",
  "mode": "semantic-poetic-source-faithful",
  "source": {
    "song_file": "works/kalaignar-thirai-isai-paadalgal/songs/song-007.md",
    "tamil_status": "verified",
    "pdf_pages": [36],
    "tamil_title": "பேசும் யாழே பெண் மானே (சோகம்)",
    "film_title_ta": "நாம்",
    "attribution_status": "anthology-attributed"
  },
  "translation": {
    "english_title": "O speaking yaazh, O doe — lament",
    "sections": [
      {
        "ordinal": 1,
        "source_label": "மீனா",
        "english_label": "Meena",
        "source_tamil_lines": [
          "பேசும் யாழே பெண் மானே",
          "வீசும் தென்றல் நீதானே",
          "கேளேனோ இனிமேல் இதுபோல் கீதம்..."
        ],
        "english_lines": [
          "O speaking yaazh, O doe,",
          "You are the breeze that blows,",
          "Will I ever again hear a song like this..."
        ],
        "notes": [
          "The opening deliberately echoes song 005 before turning into lament; `yaazh` is retained for continuity with the earlier duet."
        ]
      },
      {
        "ordinal": 2,
        "source_label": "(பேசும்)",
        "english_label": "(Pesum — source refrain cue)",
        "source_tamil_lines": [
          "(பேசும்)"
        ],
        "english_lines": [
          "(Pesum — source refrain cue)"
        ],
        "notes": [
          "The abbreviated source refrain cue is preserved and not expanded."
        ]
      },
      {
        "ordinal": 3,
        "source_label": null,
        "english_label": null,
        "source_tamil_lines": [
          "தாளா தீச்சுழலில்",
          "தனியாய் வீழ்ந்தீரோ",
          "மீளா சோகம் மீட்டிடும் யாழானேன்",
          "மாளா காதலினால் வாழ்ந்தோமே காதல்..."
        ],
        "english_lines": [
          "In an unbearable whirl of fire,",
          "Did you fall alone?",
          "I became a yaazh that plucks an unreturning sorrow,",
          "By undying love we lived — love..."
        ],
        "notes": [
          "`மீளா சோகம் மீட்டிடும் யாழானேன்` carries a yaazh-playing wordplay in `மீட்டிடும்`; `plucks an unreturning sorrow` keeps that musical action rather than smoothing it to `I sing of grief`.",
          "The fire-whirl and undying-love language is retained without reducing the stanza to bereavement prose."
        ]
      },
      {
        "ordinal": 4,
        "source_label": "(பேசும்)",
        "english_label": "(Pesum — source refrain cue)",
        "source_tamil_lines": [
          "(பேசும்)"
        ],
        "english_lines": [
          "(Pesum — source refrain cue)"
        ],
        "notes": []
      },
      {
        "ordinal": 5,
        "source_label": null,
        "english_label": null,
        "source_tamil_lines": [
          "பாடும் பேயாக பாரினில் அலைவீரோ",
          "தீரா துன்பம் தீட்டிய ஏடானேன்",
          "மாறா பாசம்தனை மறந்தீரோ நேசம்"
        ],
        "english_lines": [
          "Will you wander the earth as a singing ghost?",
          "I became a page on which endless sorrow was inscribed,",
          "Did you forget the affection that never changes — love?"
        ],
        "notes": [
          "The source's stark `singing ghost` image is retained rather than softened.",
          "`தீட்டிய ஏடானேன்` remains a written-page image: sorrow is inscribed on the speaker."
        ]
      },
      {
        "ordinal": 6,
        "source_label": "(பேசும்)",
        "english_label": "(Pesum — source refrain cue)",
        "source_tamil_lines": [
          "(பேசும்)"
        ],
        "english_lines": [
          "(Pesum — source refrain cue)"
        ],
        "notes": []
      }
    ],
    "translator_notes": [
      "The translation preserves the deliberate relationship to song 005 while allowing the same yaazh image to become an instrument of grief.",
      "The source's ghost, inscribed-page and unreturning-sorrow images remain intact even where the English is intentionally unusual.",
      "This is a literary source-faithful translation, not a singable adaptation."
    ]
  }
}
